{
  "id": "qimao-submit",
  "platformId": "qimao",
  "title": "七猫小说投稿与签约指南",
  "summary": "七猫小说的投稿流程，门槛低、审核快，适合新手练手。",
  "steps": [
    {
      "title": "注册作者账号",
      "description": "访问七猫小说作者后台，使用手机号注册作者账号。注册流程简单快捷。",
      "tips": [
        "注册后需要完善个人信息",
        "建议先阅读平台的作者规范"
      ]
    },
    {
      "title": "创建作品",
      "description": "在作者后台创建新作品，填写书名、简介、分类等信息。七猫支持多种题材，以都市、言情、玄幻为主。",
      "tips": [
        "七猫读者偏好节奏快、爽点密集的作品",
        "书名和简介要直白有力",
        "分类选择要准确"
      ]
    },
    {
      "title": "上传章节并申请签约",
      "description": "上传章节内容，达到一定字数后可申请签约。七猫的签约审核速度快，门槛较低。",
      "tips": [
        "建议先存稿再上传，保持稳定更新",
        "签约条件相对宽松",
        "审核周期短，通常几天内有结果"
      ]
    },
    {
      "title": "签约后运营",
      "description": "签约后作品进入推荐池，通过平台算法获得更多曝光。保持更新频率是关键。",
      "tips": [
        "日更或隔日更新，保持活跃度",
        "关注读者反馈，适当调整写作方向",
        "利用平台活动获得额外曝光"
      ]
    }
  ],
  "faq": [
    {
      "question": "七猫和番茄有什么区别？",
      "answer": "两者都是免费阅读平台，模式类似。七猫的用户群体偏下沉市场，审核速度也很快。具体选择可以根据个人偏好和作品类型决定。"
    },
    {
      "question": "七猫的收入模式是什么？",
      "answer": "七猫采用广告分成模式，收入根据阅读量计算。具体分成比例以签约合同为准。"
    },
    {
      "question": "七猫适合写什么类型？",
      "answer": "七猫以都市、言情、玄幻为主要热门分类。节奏快、爽点密集的作品更受欢迎。"
    }
  ],
  "riskNotes": [
    "签约前务必仔细阅读合同条款，了解版权归属和分成比例。",
    "免费模式下收入与阅读量挂钩，不要对收入有过高预期。",
    "遵守平台规范，避免违规内容。",
    "本站信息仅供参考，具体规则以七猫官方最新公告为准。"
  ],
  "officialSources": [
    { "name": "七猫小说官网", "url": "https://www.qimao.com" },
    { "name": "七猫作者后台", "url": "https://write.qimao.com" }
  ],
  "lastChecked": "2026-06-05",
  "schemaVersion": 1
}
