{
  "id": "fanqie-submit",
  "platformId": "fanqie",
  "title": "番茄小说投稿与签约指南",
  "summary": "番茄小说的注册、发文、签约流程，门槛低，适合新手入门。",
  "steps": [
    {
      "title": "注册作者账号",
      "description": "访问番茄小说作者后台（author.snssdk.com），使用手机号注册。也可以通过抖音账号直接登录。",
      "tips": [
        "注册流程简单，审核速度快",
        "建议使用常用手机号，方便接收通知"
      ]
    },
    {
      "title": "创建作品",
      "description": "在作者后台创建新作品，填写书名、简介、分类等信息。番茄支持多种题材，包括言情、玄幻、都市、悬疑等。",
      "tips": [
        "书名要吸引眼球，突出爽点",
        "简介要直击痛点，让读者有点击欲望",
        "分类选择影响推荐流量"
      ]
    },
    {
      "title": "上传章节",
      "description": "开始上传章节内容。番茄小说对更新频率有一定要求，建议保持日更。",
      "tips": [
        "每章 1500-2500 字为宜",
        "开头几章要抓人，免费模式下读者耐心有限",
        "保持日更节奏，断更要及时通知读者"
      ]
    },
    {
      "title": "申请签约",
      "description": "当作品达到 2 万字以上，可以申请签约。番茄的签约门槛相对较低，审核速度也较快。",
      "tips": [
        "签约条件宽松，但作品质量仍需保证",
        "签约后可以获得更多推荐流量",
        "签约前仔细阅读合同条款"
      ]
    },
    {
      "title": "签约后收益",
      "description": "签约作品可以通过广告分成获得收入。番茄还设有全勤奖、完本奖励等激励机制。",
      "tips": [
        "全勤奖需要保持每日更新",
        "完本奖励在作品完结后发放",
        "收入与阅读量直接挂钩，需要持续更新维护"
      ]
    }
  ],
  "faq": [
    {
      "question": "番茄小说的收入怎么算？",
      "answer": "番茄采用广告分成模式，收入根据作品的阅读量和广告展示量计算。具体分成比例以签约合同为准。此外还有全勤奖和完本奖励。"
    },
    {
      "question": "番茄签约难吗？",
      "answer": "相比付费平台，番茄的签约门槛较低。2 万字以上即可申请，审核速度也较快。但作品质量仍需达到一定标准。"
    },
    {
      "question": "番茄的版权归谁？",
      "answer": "签约合同中会约定版权归属和授权范围。不同合同类型条款不同，签约前务必仔细阅读。"
    },
    {
      "question": "新手适合投番茄吗？",
      "answer": "番茄门槛低、流量大，非常适合新手入门。可以在番茄积累写作经验，再考虑其他平台。"
    }
  ],
  "riskNotes": [
    "番茄签约合同涉及版权授权，签约前务必仔细阅读条款。",
    "免费模式下单本收入天花板不如付费平台，不要对收入有过高预期。",
    "注意遵守平台规范，避免违规内容导致作品下架。",
    "本站信息仅供参考，具体规则以番茄官方最新公告为准。"
  ],
  "officialSources": [
    { "name": "番茄小说官网", "url": "https://fanqie.com" },
    { "name": "番茄作者后台", "url": "https://writer.fanqie.com" }
  ],
  "lastChecked": "2026-06-05",
  "schemaVersion": 1
}
