{
  "id": "jjwxc-submit",
  "platformId": "jjwxc",
  "title": "晋江文学城投稿与签约指南",
  "summary": "晋江文学城的注册、发文、签约流程，适合女性向创作者参考。",
  "steps": [
    {
      "title": "注册作者账号",
      "description": "访问晋江文学城（jjwxc.net），注册账号后在「作者中心」申请成为作者。需要填写笔名、个人简介等信息。",
      "tips": [
        "晋江笔名一旦设定不可修改，请慎重选择",
        "建议先浏览平台热门作品，了解平台风格"
      ]
    },
    {
      "title": "创建作品并发文",
      "description": "在作者中心创建新作品，选择分类（言情、纯爱、百合等），填写文案和标签。然后开始上传章节内容。",
      "tips": [
        "晋江文案（简介）非常重要，直接影响点击率",
        "标签要选准，影响被搜索和推荐的概率",
        "晋江读者对文笔有一定要求，注意语言质量"
      ]
    },
    {
      "title": "积累数据",
      "description": "持续更新作品，积累收藏、点击、评论等数据。晋江的签约审核会参考这些数据指标。",
      "tips": [
        "保持稳定更新，建议至少隔日更新",
        "积极回复读者评论，增加互动",
        "晋江有「榜单」机制，好的数据可以上榜获得更多曝光"
      ]
    },
    {
      "title": "申请签约（入V）",
      "description": "当作品达到一定字数和数据要求后，可申请「入V」（VIP，即签约上架）。入V后章节需要付费阅读。",
      "tips": [
        "入V一般需要 3 万字以上且有一定数据基础",
        "入V前建议存稿，确保上架后能稳定更新",
        "入V章节定价由作者设定，但有平台建议范围"
      ]
    },
    {
      "title": "签约后运营",
      "description": "入V后保持更新，通过晋江的推荐机制和读者口碑获得更多阅读量。晋江有完善的榜单和推荐系统。",
      "tips": [
        "完结后可以申请完结榜，获得额外曝光",
        "注意遵守平台规范，避免违规内容"
      ]
    }
  ],
  "faq": [
    {
      "question": "晋江主要适合写什么类型？",
      "answer": "晋江以女性向内容为主，言情、纯爱（耽美）、百合是最热门的分类。也有奇幻、悬疑等类型，但流量相对较小。"
    },
    {
      "question": "晋江的收入模式是什么？",
      "answer": "晋江采用付费阅读模式，读者购买「晋江币」来阅读VIP章节。作者获得分成，具体比例以签约合同为准。"
    },
    {
      "question": "入V后可以修改已发布的章节吗？",
      "answer": "可以修改，但VIP章节的修改有次数限制。建议在发布前仔细校对。"
    }
  ],
  "riskNotes": [
    "晋江签约合同涉及版权授权，签约前务必仔细阅读条款，特别关注授权范围和期限。",
    "晋江对内容审核较严格，注意遵守平台规范，避免涉及敏感话题。",
    "本站信息仅供参考，具体规则以晋江官方最新公告为准。"
  ],
  "officialSources": [
    { "name": "晋江文学城", "url": "https://www.jjwxc.net" },
    { "name": "晋江作者后台", "url": "https://www.jjwxc.net/oneauthor.php" }
  ],
  "lastChecked": "2026-06-05",
  "schemaVersion": 1
}
