{
  "id": "qidian-submit",
  "platformId": "qidian",
  "title": "起点中文网投稿与签约指南",
  "summary": "从注册作者账号到签约上架的完整流程，适合新手参考。",
  "steps": [
    {
      "title": "注册作者账号",
      "description": "访问起点作家专区（author.qidian.com），使用手机号或QQ注册作者账号。注意：作者账号与读者账号独立，需要单独注册。",
      "tips": [
        "建议使用常用手机号注册，方便后续找回",
        "注册后需完善个人信息（笔名、简介等）"
      ]
    },
    {
      "title": "创建作品",
      "description": "在作家专区点击「创建新作品」，填写作品名称、分类、简介、标签等信息。选择作品类型（男频/女频）和具体分类（玄幻、都市等）。",
      "tips": [
        "作品名称建议简洁有力，突出卖点",
        "简介前两句话最关键，决定读者是否继续看",
        "分类选择要准确，影响推荐算法匹配"
      ]
    },
    {
      "title": "上传章节",
      "description": "在作品管理页面上传章节内容。建议先存稿 3-5 万字再开始上传，保持稳定更新节奏。",
      "tips": [
        "每章建议 2000-3000 字，不宜过短",
        "章节标题可以加小标题增加吸引力",
        "上传前仔细检查错别字和格式"
      ]
    },
    {
      "title": "申请签约",
      "description": "当作品达到一定字数（通常 5-10 万字）且更新稳定后，可在后台申请签约。编辑会审核作品质量、数据表现和更新频率。",
      "tips": [
        "签约前保持日更，展示稳定的创作能力",
        "收藏和推荐数据会影响签约审核",
        "耐心等待，审核周期一般 1-2 周"
      ]
    },
    {
      "title": "签约后上架",
      "description": "签约成功后，作品可在达到一定字数后申请上架（付费阅读）。上架后读者需要付费才能阅读后续章节，作者获得分成收入。",
      "tips": [
        "上架时机很重要，一般在剧情高潮处上架效果好",
        "上架前可以设置免费章节吸引读者",
        "上架后需要保持更新频率，否则读者流失快"
      ]
    }
  ],
  "faq": [
    {
      "question": "起点签约需要多少字？",
      "answer": "没有绝对的字数要求，但通常建议至少 5 万字以上再申请。编辑主要看作品质量、数据表现和更新稳定性。"
    },
    {
      "question": "签约后版权归谁？",
      "answer": "具体以合同条款为准。起点的签约合同通常涉及电子版权的授权，不同合同类型（分成、买断等）条款不同。签约前务必仔细阅读合同全文。"
    },
    {
      "question": "新手适合直接投起点吗？",
      "answer": "起点竞争激烈，对新人来说难度较大。如果你对自己的写作有信心，且愿意长期坚持，可以尝试。否则建议先在门槛较低的平台积累经验。"
    },
    {
      "question": "收入大概有多少？",
      "answer": "收入因人而异，差距极大。新手作者月收入可能从几百到几千元不等，头部作者可以月入数万甚至更多。不要以收入作为唯一考量。"
    }
  ],
  "riskNotes": [
    "签约前务必仔细阅读合同条款，特别注意版权归属、分成比例、合同期限等关键条款。",
    "不要轻信「保底收入」「 guaranteed 月入过万」等宣传，实际收入取决于作品质量和读者市场。",
    "如有疑问，建议咨询有经验的作者或法律人士。",
    "本站信息仅供参考，具体规则以起点官方最新公告为准。"
  ],
  "officialSources": [
    { "name": "起点作家专区", "url": "https://write.qidian.com" },
    { "name": "起点帮助中心", "url": "https://help.qidian.com" }
  ],
  "lastChecked": "2026-06-05",
  "schemaVersion": 1
}
